{
  "model": "<MODEL_ID>",
  "created_at": "2026-10-17T00:00:00Z",
  "message": {
    "role": "assistant",
    "content": "Hello"
  },
  "done": true,
  "done_reason": "stop",
  "total_duration": 10000000,
  "load_duration": 1000000,
  "prompt_eval_count": 1,
  "prompt_eval_cached_count": 0,
  "prompt_eval_duration": 2000000,
  "eval_count": 2,
  "eval_duration": 7000000
}
